{
  "$schema": "https://json-schema.org/draft/2020-12/schema",
  "$id": "https://hermes-agent.local/schemas/flight-calendar-ics-itinerary.v1.json",
  "title": "flight-calendar-ics minimal itinerary",
  "description": "Minimal internal itinerary consumed by the flight-calendar-ics CLI. One flights[] item becomes one VEVENT.",
  "type": "object",
  "additionalProperties": false,
  "required": [
    "flights"
  ],
  "properties": {
    "passenger": {
      "$ref": "#/$defs/non_empty_string"
    },
    "pnr": {
      "$ref": "#/$defs/short_string"
    },
    "ticket_number": {
      "$ref": "#/$defs/short_string"
    },
    "booking_url": {
      "type": "string",
      "format": "uri"
    },
    "flights": {
      "type": "array",
      "minItems": 1,
      "items": {
        "$ref": "#/$defs/flight_segment"
      }
    }
  },
  "$defs": {
    "non_empty_string": {
      "type": "string",
      "minLength": 1
    },
    "short_string": {
      "type": "string",
      "minLength": 1,
      "maxLength": 256
    },
    "iata_airport": {
      "type": "string",
      "pattern": "^[A-Z]{3}$"
    },
    "local_datetime": {
      "type": "string",
      "pattern": "^\\d{4}-\\d{2}-\\d{2}[T ]\\d{2}:\\d{2}(:\\d{2})?$"
    },
    "airport_endpoint": {
      "type": "object",
      "additionalProperties": false,
      "required": [
        "airport",
        "local"
      ],
      "properties": {
        "airport": {
          "$ref": "#/$defs/iata_airport"
        },
        "city": {
          "$ref": "#/$defs/non_empty_string"
        },
        "local": {
          "$ref": "#/$defs/local_datetime"
        }
      }
    },
    "flight_segment": {
      "type": "object",
      "additionalProperties": false,
      "required": [
        "flight_number",
        "departure",
        "arrival"
      ],
      "properties": {
        "flight_number": {
          "type": "string",
          "pattern": "^[A-Z0-9]{2,3} ?[0-9]{1,5}[A-Z]?$"
        },
        "departure": {
          "$ref": "#/$defs/airport_endpoint"
        },
        "arrival": {
          "$ref": "#/$defs/airport_endpoint"
        },
        "aircraft": {
          "$ref": "#/$defs/non_empty_string"
        }
      }
    }
  }
}
