{
  "passenger": "KONSTANTIN ORLOV",
  "pnr": "ABC123",
  "ticket_number": "5552400000000",
  "booking_url": "https://carrier.example/manage",
  "flights": [
    {
      "flight_number": "SU1234",
      "departure": {
        "airport": "SVO",
        "city": "Москва",
        "local": "2026-06-01T09:15"
      },
      "arrival": {
        "airport": "SVX",
        "city": "Екатеринбург",
        "local": "2026-06-01T13:45"
      },
      "aircraft": "Boeing 737"
    }
  ]
}